Symbol,Name,Last_Sale,Net_Change,Change,Country,IPO_Year,Sector,Industry
IQI,Invesco Quality Municipal Income Trust Common Stock,12.8399,0.0199,0.155,United States,,,
IQV,IQVIA Holdings Inc. Common Stock,186.6,-0.39,-0.209,United States,2013,Health Care,Biotechnology: Commercial Physical & Biological Resarch
IR,Ingersoll Rand Inc. Common Stock,48.7,1.56,3.309,United States,2017,Technology,Industrial Machinery/Components
IRBT,iRobot Corporation Common Stock,114.37,-3.59,-3.043,United States,2005,Consumer Durables,Consumer Electronics/Appliances
IRCP,IRSA Propiedades Comerciales S.A. American Depositary Shares,10.025,0.045,0.451,Argentina,,Consumer Services,Building operators
IRDM,Iridium Communications Inc Common Stock,37.79,0,0,United States,,Capital Goods,Telecommunications Equipment
IRIX,IRIDEX Corporation Common Stock,7.25,-0.15,-2.027,United States,1996,Health Care,Biotechnology: Electromedical & Electrotherapeutic Apparatus
IRL,New Ireland Fund Inc (The) Common Stock,11.4016,-0.0184,-0.161,United States,1990,,
IRM,Iron Mountain Incorporated (Delaware)Common Stock REIT,36.905,0.645,1.779,United States,,Consumer Services,Real Estate Investment Trusts
IRMD,iRadimed Corporation Common Stock,23.55,-0.45,-1.875,United States,2014,Health Care,Medical/Dental Instruments
IROQ,IF Bancorp Inc. Common Stock,21.1,-0.4,-1.86,United States,2011,Finance,Savings Institutions
IRR,Voya Natural Resources Equity Income Fund Common Shares of Beneficial Interest,3.08,0.05,1.65,United States,,,
IRS,IRSA Inversiones Y Representaciones S.A. Common Stock,3.8696,0.0596,1.564,Argentina,,Consumer Services,Homebuilding
IRT,Independence Realty Trust Inc. Common Stock,15.15,0.36,2.434,United States,2013,Consumer Services,Real Estate Investment Trusts
IRTC,iRhythm Technologies Inc. Common Stock,132.415,-8.515,-6.042,United States,2016,Health Care,Medical/Dental Instruments
IRWD,Ironwood Pharmaceuticals Inc. Class A Common Stock,10.645,-0.145,-1.344,United States,2010,Health Care,Major Pharmaceuticals
ISBC,Investors Bancorp Inc. Common Stock,14.11,0.27,1.951,United States,,Finance,Major Banks
ISD,PGIM High Yield Bond Fund Inc.,15.6,0.01,0.064,United States,2012,,
ISDR,Issuer Direct Corporation Common Stock,22.8,-0.03,-0.131,United States,,Miscellaneous,Publishing
ISEE,IVERIC bio Inc. Common Stock,5.98,-0.26,-4.167,United States,2013,Health Care,Major Pharmaceuticals
ISIG,Insignia Systems Inc. Common Stock,6.06,-0.21,-3.349,United States,1991,Consumer Services,Advertising
ISLEU,Isleworth Healthcare Acquisition Corporation Unit,9.87,0,0,United States,2021,Finance,Business Services
ISNS,Image Sensing Systems Inc. Common Stock,4.585,-0.095,-2.03,United States,1995,Capital Goods,Industrial Machinery/Components
ISR,IsoRay Inc. Common Stock (DE),1.12,0.01,0.901,United States,,Health Care,Medical/Dental Instruments
ISRG,Intuitive Surgical Inc. Common Stock,716.945,6.125,0.862,United States,2000,Health Care,Industrial Specialties
ISSC,Innovative Solutions and Support Inc. Common Stock,6.18,0.08,1.311,United States,2000,Technology,EDP Services
ISTR,Investar Holding Corporation Common Stock,21.02,0.2,0.961,United States,2014,Finance,Major Banks
ISUN,iSun Inc. Common Stock,14.19,0.08,0.567,United States,2016,Technology,Semiconductors
IT,Gartner Inc. Common Stock,183,1.38,0.76,United States,1993,Consumer Services,Other Consumer Services
ITAC,Industrial Tech Acquisitions Inc. Class A common stock,9.91,-0.09,-0.9,United States,2020,Finance,Business Services
ITACU,Industrial Tech Acquisitions Inc. Unit,11.01,-0.37,-3.251,United States,2020,Finance,Business Services
ITACW,Industrial Tech Acquisitions Inc. Warrant,1.2199,-0.15,-10.95,United States,2020,Finance,Business Services
ITCB,Itau CorpBanca American Depositary Shares (each representing 1500 shares of Common Stock no par value),5.705,0.035,0.617,Chile,,Finance,Commercial Banks
ITCI,Intra-Cellular Therapies Inc. Common Stock,31.785,-0.755,-2.32,United States,,Health Care,Major Pharmaceuticals
ITGR,Integer Holdings Corporation Common Stock,87.44,-0.16,-0.183,United States,,Miscellaneous,Industrial Machinery/Components
ITHX,ITHAX Acquisition Corp. Class A Ordinary Shares,9.95,9.95,,United States,2021,Finance,Business Services
ITHXU,ITHAX Acquisition Corp. Unit,9.87,-0.03,-0.303,United States,2021,Finance,Business Services
ITHXW,ITHAX Acquisition Corp. Warrant,0.8018,0.1518,23.354,United States,2021,Finance,Business Services
ITI,Iteris Inc. Common Stock,6.4,0.04,0.629,United States,,Capital Goods,Telecommunications Equipment
ITIC,Investors Title Company Common Stock,163.37,0,0,United States,,Finance,Specialty Insurers
ITMR,Itamar Medical Ltd. American Depository Shares,22.37,-0.1,-0.445,Israel,,Health Care,Medical/Dental Instruments
ITOS,iTeos Therapeutics Inc. Common Stock,33.13,-2.96,-8.202,United States,2020,Health Care,Biotechnology: Biological Products (No Diagnostic Substances)
ITP,IT Tech Packaging Inc. Common Stock,0.6844,-0.0056,-0.812,China,,Consumer Durables,Containers/Packaging
ITQRU,Itiquira Acquisition Corp. Unit,9.8504,-0.1096,-1.1,United States,2021,Finance,Business Services
ITRG,Integra Resources Corp. Common Shares,2.88,-0.0301,-1.034,,,Basic Industries,Precious Metals
ITRI,Itron Inc. Common Stock,85.955,-2.055,-2.335,United States,1993,Capital Goods,Electrical Products
ITRM,Iterum Therapeutics plc Ordinary Share,1.5393,0.0093,0.608,Ireland,2018,Health Care,Major Pharmaceuticals
ITRN,Ituran Location and Control Ltd. Ordinary Shares,21.395,-0.115,-0.535,Israel,2005,Technology,Electronic Components
ITT,ITT Inc. Common Stock ,86.685,2.265,2.683,United States,2011,Capital Goods,Fluid Controls
ITUB,Itau Unibanco Banco Holding SA American Depositary Shares (Each repstg 500 Preferred shares),4.9385,-0.0415,-0.833,Brazil,,Finance,Major Banks
ITW,Illinois Tool Works Inc. Common Stock,221.13,4.4,2.03,United States,,Technology,Industrial Machinery/Components
IVA,Inventiva S.A. American Depository Shares,14.82,2.26,17.994,France,2020,Health Care,Major Pharmaceuticals
IVAC,Intevac Inc. Common Stock,5.75,0.135,2.404,United States,1995,Technology,Industrial Machinery/Components
IVAN,Ivanhoe Capital Acquisition Corp. Class A Ordinary Shares,9.92,-0.02,-0.201,,2021,Finance,Business Services
IVC,Invacare Corporation Common Stock,7.96,-0.03,-0.375,United States,,Health Care,Industrial Specialties
IVDG,Invesco Focused Discovery Growth ETF,11.6501,-0.0338,-0.289,United States,2020,,
IVH,Ivy High Income Opportunities Fund Common Shares of Beneficial Interest,13.66,0.05,0.367,,2013,,
IVLC,Invesco US Large Cap Core ESG ETF,12.54,0.069,0.553,United States,2020,,
IVR,INVESCO MORTGAGE CAPITAL INC Common Stock,3.93,0.01,0.255,United States,2009,Consumer Services,Real Estate Investment Trusts
IVR^A,Invesco Mortgage Capital Inc. Pfd Ser A,24.76,-0.03,-0.121,United States,,,
IVR^B,Invesco Mortgage Capital Inc. Preferred Series B Cum Fxd to Fltg,24.13,0.05,0.208,United States,,,
IVR^C,INVESCO MORTGAGE CAPITAL INC 7.5 Fixed-to-Floating Series C Cumulative Redeemable Preferred Stock Liquation Preference 25.00 per Share,24.05,0.04,0.167,United States,,,
IVRA,Invesco Real Assets ESG ETF,12.8,0.0361,0.283,United States,2020,,
IVSG,Invesco Select Growth ETF,12.2708,0,0,United States,2020,,
IVZ,Invesco Ltd Common Stock,23.73,0.07,0.296,United States,,Finance,Investment Managers
IX,Orix Corp Ads Common Stock,88.0388,-1.1312,-1.269,Japan,,Finance,Diversified Financial Services
IZEA,IZEA Worldwide Inc. Common Stock,4.08,-0.25,-5.774,United States,,Consumer Services,Advertising
J,Jacobs Engineering Group Inc. Common Stock,124,2.2,1.806,United States,,Basic Industries,Military/Government/Technical
JACK,Jack In The Box Inc. Common Stock,110.77,-1.32,-1.178,United States,,Consumer Services,Restaurants
JAGX,Jaguar Health Inc. Common Stock,1.88,-0.08,-4.082,United States,2015,Health Care,Major Pharmaceuticals
JAKK,JAKKS Pacific Inc. Common Stock,8.3932,-0.0268,-0.318,United States,1996,Consumer Non-Durables,Recreational Products/Toys
JAMF,Jamf Holding Corp. Common Stock,35.49,-1.38,-3.743,United States,2020,Technology,Computer Software: Prepackaged Software
JAN,JanOne Inc. Common Stock (NV),7.885,-0.455,-5.456,United States,,Consumer Services,Home Furnishings
JANZ,TrueShares Structured Outcome (January) ETF,26.0834,-0.1645,-0.627,United States,2021,,
JAX,J. Alexander's Holdings Inc. Common Stock,9.1,-0.07,-0.763,,2015,Consumer Services,Restaurants
JAZZ,Jazz Pharmaceuticals plc Common Stock (Ireland),164.79,0.48,0.292,Ireland,2007,Health Care,Major Pharmaceuticals
JBGS,JBG SMITH Properties Common Shares ,32.265,1.225,3.947,United States,2017,Consumer Services,Real Estate Investment Trusts
JBHT,J.B. Hunt Transport Services Inc. Common Stock,159.72,3.77,2.417,United States,,Transportation,Trucking Freight/Courier Services
JBL,Jabil Inc. Common Stock,49.5,1.03,2.125,United States,1993,Technology,Electrical Products
JBLU,JetBlue Airways Corporation Common Stock,19.34,0.09,0.468,United States,2002,Transportation,Air Freight/Delivery Services
JBSS,John B. Sanfilippo & Son Inc. Common Stock,88.685,-0.455,-0.51,United States,1991,Consumer Non-Durables,Specialty Foods
JBT,John Bean Technologies Corporation Common Stock,135.11,3.91,2.98,United States,,Technology,Industrial Machinery/Components
JCE,Nuveen Core Equity Alpha Fund Nuveen Core Equity Alpha Fund Common Shares of Beneficial Interest,14.79,0.16,1.094,United States,2007,,
JCI,Johnson Controls International plc Ordinary Share,59.15,0.71,1.215,Switzerland,,Consumer Services,Other Consumer Services
JCIC,Jack Creek Investment Corp. Class A Ordinary Shares,9.72,0.08,0.83,United States,2021,Finance,Business Services
JCICU,Jack Creek Investment Corp. Units,9.895,-0.045,-0.453,United States,2021,Finance,Business Services
JCICW,Jack Creek Investment Corp. Warrants,0.6598,-0.0202,-2.971,United States,2021,Finance,Business Services
JCO,Nuveen Credit Opportunities 2022 Target Term Fund Common Shares of Beneficial Interest,8.37,0.01,0.12,United States,2017,,
JCOM,j2 Global Inc. Common Stock,116.805,-0.895,-0.76,United States,1999,Technology,Telecommunications Equipment
JCS,Communications Systems Inc. Common Stock,6.1,0.01,0.164,United States,,Public Utilities,Telecommunications Equipment
JCTCF,Jewett-Cameron Trading Company Common Shares,10.4,0.07,0.678,United States,,Consumer Services,RETAIL: Building Materials
JD,JD.com Inc. American Depositary Shares,79.42,-4.09,-4.898,China,2014,Consumer Services,Other Specialty Stores
JDD,Nuveen Diversified Dividend and Income Fund Shares of Beneficial Interest,9.19,-0.01,-0.109,United States,2003,,
JEF,Jefferies Financial Group Inc. Common Stock,33.29,0.38,1.155,United States,,Finance,Investment Bankers/Brokers/Service
JELD,JELD-WEN Holding Inc. Common Stock,26.41,0.32,1.227,United States,2017,Basic Industries,Forest Products
JEMA,J.P. Morgan Exchange-Traded Fund Trust JPMorgan Emerging Markets Equity Core ETF,47.9055,0,0,,2021,,
JEMD,Nuveen Emerging Markets Debt 2022 Target Term Fund Common Shares of Beneficial Interest 0.01 par value per share,7.9,0,0,,2017,,
JEQ,Aberdeen Japan Equity Fund Inc.  Common Stock,8.975,-0.1612,-1.764,United States,1992,,
JFIN,Jiayin Group Inc. American Depositary Shares,9.9,-0.36,-3.509,China,2019,Finance,Finance: Consumer Services
JFR,Nuveen Floating Rate Income Fund Common Stock,9.61,0.04,0.418,United States,2004,,
JFU,9F Inc. American Depositary Shares,1.871,-0.169,-8.284,China,2019,Finance,Finance: Consumer Services
JG,Aurora Mobile Limited American Depositary Shares,4.53,-0.25,-5.23,China,2018,Technology,Computer Software: Programming Data Processing
JGH,Nuveen Global High Income Fund Common Shares of Beneficial Interest,15.495,0.065,0.421,United States,2014,,
JHAA,Nuveen Corporate Income 2023 Target Term Fund,9.94,-0.06,-0.6,,2018,,
JHB,Nuveen Corporate Income November 2021 Target Term Fund,9.325,0.005,0.054,,2016,,
JHG,Janus Henderson Group plc Ordinary Shares,30.62,0.48,1.593,,2017,Finance,Investment Managers
JHI,John Hancock Investors Trust Common Stock,17.85,0.0606,0.341,United States,,,
JHS,John Hancock Income Securities Trust Common Stock,15.26,0.1,0.66,United States,,,
JHX,James Hardie Industries plc American Depositary Shares (Ireland),29.3714,0.4914,1.702,Ireland,,Capital Goods,Building Materials
JIH,Juniper Industrial Holdings Inc. Class A Common Stock,11.75,-0.35,-2.893,,2019,Finance,Business Services
JILL,J. Jill Inc. Common Stock,8.03,0.3,3.881,,2017,Consumer Non-Durables,Apparel
JJSF,J & J Snack Foods Corp. Common Stock,157.36,3.66,2.381,United States,1986,Consumer Non-Durables,Specialty Foods
JKHY,Jack Henry & Associates Inc. Common Stock,154.17,2.34,1.541,United States,1985,Technology,EDP Services
JKS,JinkoSolar Holding Company Limited American Depositary Shares (each representing 4 Common Shares),40.94,-2.76,-6.316,China,2010,Technology,Semiconductors
JLL,Jones Lang LaSalle Incorporated Common Stock,173.22,0.57,0.33,United States,,Finance,Real Estate
JLS,Nuveen Mortgage and Income Fund,20.6132,0.1432,0.7,United States,2009,,
JMIA,Jumia Technologies AG American Depositary Shares each representing two Ordinary Shares,35.66,-3.01,-7.784,,2019,Consumer Services,Catalog/Specialty Distribution
JMM,Nuveen Multi-Market Income Fund (MA),7.2,-0.02,-0.277,United States,,,
JMP,JMP Group LLC Common Shares,6.1654,-0.0746,-1.196,United States,2007,Finance,Investment Bankers/Brokers/Service
JMPNL,JMP Group LLC 7.25 Senior Notes due 2027,25.25,0,0,United States,,Finance,Investment Bankers/Brokers/Service
JMPNZ,JMP Group LLC 6.875 Senior Notes due 2029,24.4426,-0.0551,-0.225,United States,,Finance,Investment Bankers/Brokers/Service
JNCE,Jounce Therapeutics Inc. Common Stock,10.4,-1.08,-9.408,United States,2017,Health Care,Biotechnology: Biological Products (No Diagnostic Substances)
JNJ,Johnson & Johnson Common Stock,161.96,1.61,1.004,United States,,Health Care,Major Pharmaceuticals
JNPR,Juniper Networks Inc. Common Stock,24.735,-0.145,-0.583,United States,1999,Technology,Computer Communications Equipment
JOAN,JOANN Inc. Common Stock,11,-0.34,-2.998,United States,2021,Consumer Services,Other Specialty Stores
JOB,GEE Group Inc. Common Stock,1.59,-0.07,-4.217,United States,,Technology,Diversified Commercial Services
JOBS,51job Inc. American Depositary Shares,61.545,-1.565,-2.48,China,2004,Technology,Diversified Commercial Services
JOE,St. Joe Company (The) Common Stock,44.41,-0.1,-0.225,United States,,Consumer Services,Homebuilding
JOF,Japan Smaller Capitalization Fund Inc Common Stock,9.295,-0.135,-1.432,United States,1990,,
JOFFU,JOFF Fintech Acquisition Corp. Unit,9.8505,0.0005,0.005,United States,2021,Finance,Business Services
JOUT,Johnson Outdoors Inc. Class A Common Stock,135.95,0.04,0.029,United States,,Consumer Non-Durables,Recreational Products/Toys
JP,Jupai Holdings Limited American Depositary Shares each representing six ordinary shares,2.38,-0.06,-2.459,,2015,Consumer Services,Other Consumer Services
JPC,Nuveen Preferred & Income Opportunities Fund,9.25,0.02,0.217,United States,2003,,
JPI,Nuveen Preferred and Income Term Fund Common Shares of Beneficial Interest,24.955,0.115,0.463,,2012,,
JPM,JP Morgan Chase & Co. Common Stock,151.99,2.53,1.693,United States,,Finance,Major Banks
JPM^C,J P Morgan Chase & Co Depositary Shares each representing a 1/400th interest in a share of 6.00 Non-Cumulative  Preferred Stock Series EE,27.58,0.02,0.073,United States,,,
JPM^D,J P Morgan Chase & Co Depositary Shares each representing a 1/400th  interest in a share of 5.75 Non-Cumulative  Preferred Stock Series DD,27.39,0.06,0.22,United States,,,
JPM^G,J P Morgan Chase & Co Depositary Shares each representing a 1/400th interest in a share of 6.10 Non-Cumulative Preferred Stock Series AA,25.54,0.01,0.039,United States,,,
JPM^H,J P Morgan Chase & Co Depositary Shares each representing a 1/400th interest in a share of 6.15 Non-Cumulative Preferred Stock Series BB,25.53,0,0,United States,,Finance,Major Banks
JPM^J,J P Morgan Chase & Co Depositary Shares each representing a 1/400th interest in a share of JPMorgan Chase & Co. 4.75 Non-Cumulative Preferred Stock Series GG,26.43,0.13,0.494,United States,,Finance,Major Banks
JPM^K,J P Morgan Chase & Co Depositary Shares each representing a 1/400th interest in a share of 4.55 Non-Cumulative Preferred Stock Series JJ,25.345,0.055,0.217,United States,,,
JPS,Nuveen Preferred & Income Securities Fund,9.4367,0.0367,0.39,United States,2002,,
JPT,Nuveen Preferred and Income 2022 Term Fund Common Shares of Beneficial Interest,24.3378,-0.0316,-0.13,United States,2017,,
JQC,Nuveen Credit Strategies Income Fund Shares of Beneficial Interest,6.45,0.01,0.155,United States,2003,,
JRI,Nuveen Real Asset Income and Growth Fund Common Shares of Beneficial Interest,14.5359,0.0259,0.178,United States,2012,,
JRJC,China Finance Online Co. Limited American Depositary Shares,12.7932,-0.9568,-6.959,China,2004,Finance,Investment Bankers/Brokers/Service
JRO,Nuveen Floating Rate Income Opportuntiy Fund Shares of Beneficial Interest,9.51,0.02,0.211,United States,2004,,
JRS,Nuveen Real Estate Income Fund Common Shares of Beneficial Interest,9.3593,0.0193,0.207,United States,2001,,
JRSH,Jerash Holdings (US) Inc. Common Stock,5.81,-0.36,-5.835,United States,2018,Consumer Non-Durables,Apparel
JRVR,James River Group Holdings Ltd. Common Shares,44.8496,0.1996,0.447,Bermuda,2014,Finance,Property-Casualty Insurers
JSD,Nuveen Short Duration Credit Opportunities Fund Common Shares of Beneficial Interest,14.15,-0.01,-0.071,United States,2011,,
JSM,Navient Corporation 6 Senior Notes due December 15 2043,24.112,-0.028,-0.116,United States,,Finance,Finance: Consumer Services
JT,Jianpu Technology Inc. American depositary shares,3.04,0.03,0.997,,2017,Technology,Computer Software: Programming Data Processing
JTA,Nuveen Tax-Advantaged Total Return Strategy Fund Common Share of Beneficial Interest,10.42,-0.03,-0.287,United States,2004,,
JTD,Nuveen Tax-Advantaged Dividend Growth Fund Common Shares of Beneficial Interest,14.74,0.08,0.546,United States,,,
JULZ,TrueShares Structured Outcome (July) ETF,30.0758,-0.2012,-0.665,United States,2020,,
JUPW,Jupiter Wellness Inc. Common Stock,5.5992,0.1492,2.738,United States,2020,Consumer Non-Durables,Package Goods/Cosmetics
JUPWW,Jupiter Wellness Inc. Warrant,2.04,-0.145,-6.636,United States,2020,Consumer Non-Durables,Package Goods/Cosmetics
JVA,Coffee Holding Co. Inc. Common Stock,5.09,0.15,3.036,United States,2005,Consumer Non-Durables,Packaged Foods
JW/A,John Wiley & Sons Inc.,52.82,0.49,0.936,United States,,,
JW/B,John Wiley & Sons Inc.,53.52,0,0,United States,,,
JWEL,Jowell Global Ltd. Ordinary Shares,7.3,-0.04,-0.545,China,2021,Consumer Services,Other Consumer Services
JWN,Nordstrom Inc. Common Stock,36.37,-0.57,-1.543,United States,,Consumer Services,Clothing/Shoe/Accessory Stores
JWS,Jaws Acquisition Corp. Class A Ordinary Shares,13.73,-0.06,-0.435,,2020,Health Care,Medical/Nursing Services
JYAC,Jiya Acquisition Corp. Class A Common Stock,9.7,-0.17,-1.722,United States,2020,Finance,Business Services
JYNT,The Joint Corp. Common Stock,42.95,0.2,0.468,United States,2014,Miscellaneous,Multi-Sector Companies
K,Kellogg Company Common Stock,61.34,-1.25,-1.997,United States,,Consumer Non-Durables,Packaged Foods
KAI,Kadant Inc Common Stock,174.59,-0.41,-0.234,United States,,Technology,Industrial Machinery/Components
KAIIU,Kismet Acquisition Two Corp. Unit,9.82,-0.11,-1.108,United States,2021,Finance,Business Services
KAIR,Kairos Acquisition Corp. Class A Ordinary Shares,9.64,-0.05,-0.516,United States,2021,Finance,Business Services
KAIRU,Kairos Acquisition Corp. Unit,9.97,-0.05,-0.499,United States,2021,Finance,Business Services
KAIRW,Kairos Acquisition Corp. Warrant,0.7,0.02,2.941,United States,2021,Finance,Business Services
KALA,Kala Pharmaceuticals Inc. Common Stock,7.4799,-0.1701,-2.224,United States,2017,Health Care,Major Pharmaceuticals
KALU,Kaiser Aluminum Corporation Common Stock,107.73,2.88,2.747,United States,,Capital Goods,Metal Fabrications
KALV,KalVista Pharmaceuticals Inc. Common Stock,29.79,-0.78,-2.552,United Kingdom,2015,Health Care,Major Pharmaceuticals
KAMN,Kaman Corporation Common Stock,52.2,1.97,3.922,United States,,Capital Goods,Military/Government/Technical
KAR,KAR Auction Services Inc Common Stock,15.105,0.425,2.895,United States,2009,Consumer Durables,Automotive Aftermarket
KB,KB Financial Group Inc,44.91,0.17,0.38,South Korea,,Finance,Commercial Banks
KBAL,Kimball International Inc. Class B Common Stock,13.47,0.22,1.66,United States,,Consumer Durables,Home Furnishings
KBH,KB Home Common Stock,43.8,0.44,1.015,United States,1986,Capital Goods,Homebuilding
KBNT,Kubient Inc. Common Stock,6.95,-0.48,-6.46,United States,2020,Technology,EDP Services
KBNTW,Kubient Inc. Warrant,2.84,-0.29,-9.265,United States,2020,Technology,EDP Services
KBR,KBR Inc. Common Stock,31.94,0.81,2.602,United States,2006,Basic Industries,Military/Government/Technical
KBSF,KBS Fashion Group Limited Common Stock,3.62,0.02,0.556,China,2013,Consumer Non-Durables,Apparel
KC,Kingsoft Cloud Holdings Limited American Depositary Shares,41.25,-2.62,-5.972,China,2020,Technology,Computer Software: Prepackaged Software
KCAPL,KCAP Financial Inc. 6.125 Notes due 2022,25.37,0,0,United States,,,
KDMN,Kadmon Holdings Inc. Common Stock,3.95,-0.045,-1.126,United States,,Health Care,Major Pharmaceuticals
KDNY,Chinook Therapeutics Inc. Common Stock,18.47,-0.19,-1.018,United States,2015,Health Care,Major Pharmaceuticals
KDP,Keurig Dr Pepper Inc. Common Stock,34.485,-0.125,-0.361,United States,,Consumer Non-Durables,Beverages (Production/Distribution)
KE,Kimball Electronics Inc. Common Stock,25.359,0.469,1.884,United States,,Technology,Electrical Products
KELYA,Kelly Services Inc. Class A Common Stock,21.62,1.16,5.67,United States,,Technology,Professional Services
KELYB,Kelly Services Inc. Class B Common Stock,20.3,0.15,0.744,United States,,Technology,Professional Services
KEN,Kenon Holdings Ltd. Ordinary Shares,30.5002,0.1502,0.495,Singapore,2015,Public Utilities,Electric Utilities: Central
KEP,Korea Electric Power Corporation Common Stock,10.1379,0.0779,0.774,South Korea,1994,Public Utilities,Electric Utilities: Central
KEQU,Kewaunee Scientific Corporation Common Stock,12.06,-0.1401,-1.148,United States,,Capital Goods,Medical Specialities
KERN,Akerna Corp. Common Stock,5.18,0.28,5.714,United States,2018,Technology,EDP Services
KERNW,Akerna Corp Warrant,1.51,-0.065,-4.127,United States,2018,Technology,EDP Services
KEX,Kirby Corporation Common Stock,62.02,1.77,2.938,United States,,Consumer Services,Marine Transportation
KEY,KeyCorp Common Stock,19.67,0.41,2.129,United States,,Finance,Major Banks
KEY^I,KeyCorp Depositary Shares Each Representing a 1/40th Ownership Interest in a Share of Fixed-to-Floating Rate Perpetual Non-Cumulative Preferred Stock Series E,30.1576,0.3176,1.064,United States,,,
KEY^J,KeyCorp Depositary Shares each representing a 1/40th ownership interest in a share of Fixed Rate Perpetual Non-Cumulative Preferred Stock Series F,27.0499,0.0099,0.037,United States,,,
KEY^K,KeyCorp Depositary Shares each representing a 1/40th ownership interest in a share of Fixed Rate Perpetual Non-Cumulative Preferred Stock Series G,27.77,0.12,0.434,United States,,,
KEYS,Keysight Technologies Inc. Common Stock,135.76,0.58,0.429,United States,2014,Capital Goods,Industrial Machinery/Components
KF,Korea Fund Inc. (The) New Common Stock,42.37,0.12,0.284,United States,,,
KFFB,Kentucky First Federal Bancorp Common Stock,6.71,0.14,2.131,United States,,Finance,Savings Institutions
KFRC,Kforce Inc. Common Stock,51.4,0.87,1.722,United States,1995,Technology,Professional Services
KFS,Kingsway Financial Services Inc. Common Stock (DE),4.51,-0.02,-0.442,Canada,,Finance,Property-Casualty Insurers
KFY,Korn Ferry Common Stock,61.05,0.68,1.126,United States,1999,Technology,Diversified Commercial Services
KGC,Kinross Gold Corporation Common Stock,6.685,-0.035,-0.521,Canada,,Basic Industries,Precious Metals
KHC,The Kraft Heinz Company Common Stock,38.62,-0.3,-0.771,United States,,Consumer Non-Durables,Packaged Foods
KIDS,OrthoPediatrics Corp. Common Stock,47.18,-0.61,-1.276,United States,2017,Health Care,Medical/Dental Instruments
KIIIU,Kismet Acquisition Three Corp. Unit,9.83,-0.03,-0.304,United States,2021,Finance,Business Services
KIM,Kimco Realty Corporation Common Stock,18.61,0.54,2.988,United States,,Consumer Services,Real Estate Investment Trusts
KIM^L,Kimco Realty Corporation Class L Depositary Shares each of which represents a one-one thousandth fractional interest in a share of 5.125 Class L Cumulative Redeemable Preferred Stock liquidation preference 25000.00 per share,26.41,0.22,0.84,United States,,,
KIM^M,Kimco Realty Corporation Class M Depositary Shares each of which represents a one-one thousandth fractional interest in a share of 5.25 Class M Cumulative Redeemable Preferred Stock liquidation preference 25000.00 per share,26.64,0.24,0.909,United States,,,
KIN,Kindred Biosciences Inc. Common Stock,4.525,-0.085,-1.844,United States,2013,Health Care,Major Pharmaceuticals
KINS,Kingstone Companies Inc. Common Stock,7.97,-0.15,-1.847,United States,,Finance,Property-Casualty Insurers
KINZ,KINS Technology Group Inc. Class A Common Stock,9.84,0.02,0.204,United States,2021,Finance,Business Services
KINZU,KINS Technology Group Inc. Unit,10.17,0.01,0.098,United States,2020,Finance,Business Services
KINZW,KINS Technology Group Inc. Warrant,0.79,0.0195,2.531,United States,2021,Finance,Business Services
KIO,KKR Income Opportunities Fund Common Shares,15.69,0.07,0.448,,2013,,
KIQ,Kelso Technologies Inc Ordinary Shares,0.8545,-0.0364,-4.086,Canada,,Capital Goods,Railroads
KIRK,Kirkland's Inc. COMMONSTOCK,25.965,-0.845,-3.152,United States,2002,Consumer Services,Other Specialty Stores
KJUL,Innovator Russell 2000 Power Buffer ETF - July,26.39,0.0801,0.304,,2020,,
KKR,KKR & Co. Inc. Common Stock,48.22,0.35,0.731,United States,,Finance,Investment Managers
