Symbol,Name,Last_Sale,Net_Change,Change,Country,IPO_Year,Sector,Industry
A,Agilent Technologies Inc. Common Stock,121.255,-0.725,-0.594,United States,,Capital Goods,Biotechnology: Laboratory Analytical Instruments
AACG,ATA Creativity Global American Depositary Shares,4.17,-0.22,-5.011,China,2002,Consumer Services,Other Consumer Services
AACQ,Artius Acquisition Inc. Class A Common Stock,10.12,-0.01,-0.099,United States,2020,Basic Industries,Major Chemicals
AACQU,Artius Acquisition Inc. Unit ,10.7,-0.04,-0.372,United States,2020,Basic Industries,Major Chemicals
AACQW,Artius Acquisition Inc Warrant,1.88,-0.06,-3.093,United States,2020,Basic Industries,Major Chemicals
AAIC,Arlington Asset Investment Corp Class A (new),4.02,0.09,2.29,United States,1999,Consumer Services,Real Estate Investment Trusts
AAL,American Airlines Group Inc. Common Stock,22.7074,0.4374,1.964,United States,2005,Transportation,Air Freight/Delivery Services
AAMC,Altisource Asset Management Corp Com,17.79,-0.13,-0.725,United States,2010,Finance,Real Estate
AAME,Atlantic American Corporation Common Stock,4.5353,-0.6047,-11.765,United States,2003,Finance,Life Insurance
AAN,Aarons Holdings Company Inc. Common Stock ,24.5503,0.5303,2.208,United States,2020,Technology,Diversified Commercial Services
AAOI,Applied Optoelectronics Inc. Common Stock,7.98,-0.11,-1.36,United States,2013,Technology,Semiconductors
AAON,AAON Inc. Common Stock,70.65,0.6,0.857,United States,,Capital Goods,Industrial Machinery/Components
AAP,Advance Auto Parts Inc Advance Auto Parts Inc W/I,182.67,3.14,1.749,United States,2001,Consumer Services,Other Specialty Stores
AAPL,Apple Inc. Common Stock,121.45,-1.09,-0.89,United States,1980,Technology,Computer Manufacturing
AAT,American Assets Trust Inc. Common Stock,33.23,0.7,2.152,United States,2011,Consumer Services,Real Estate Investment Trusts
AAWW,Atlas Air Worldwide Holdings NEW Common Stock,57.245,-0.005,-0.009,United States,1998,Transportation,Transportation Services
AB,AllianceBernstein Holding L.P.  Units,40.7,-0.16,-0.392,United States,,Finance,Investment Managers
ABB,ABB Ltd Common Stock,31.025,-0.005,-0.016,Switzerland,,Consumer Durables,Electrical Products
ABBV,AbbVie Inc. Common Stock,103.67,-1.17,-1.116,United States,2012,Health Care,Major Pharmaceuticals
ABC,AmerisourceBergen Corporation Common Stock,116.12,2.35,2.066,United States,2001,Health Care,Other Pharmaceuticals
ABCB,Ameris Bancorp Common Stock,53.135,1.145,2.202,United States,1994,Finance,Major Banks
ABCL,AbCellera Biologics Inc. Common Shares,28.05,-1.18,-4.037,Canada,2020,Health Care,Major Pharmaceuticals
ABCM,Abcam plc American Depositary Shares,19.82,-0.66,-3.223,United Kingdom,2020,Health Care,Biotechnology: Biological Products (No Diagnostic Substances)
ABEO,Abeona Therapeutics Inc. Common Stock,1.92,0.02,1.053,United States,,Health Care,Major Pharmaceuticals
ABEV,Ambev S.A. American Depositary Shares (Each representing 1 Common Share),2.76,-0.01,-0.361,,2013,Consumer Non-Durables,Beverages (Production/Distribution)
ABG,Asbury Automotive Group Inc Common Stock,184.205,3.845,2.132,United States,2002,Consumer Durables,Automotive Aftermarket
ABGI,ABG Acquisition Corp. I Class A Ordinary Shares,9.76,-0.09,-0.914,United States,2021,Finance,Business Services
ABIO,ARCA biopharma Inc. Common Stock,3.81,-0.11,-2.806,United States,,Health Care,Biotechnology: In Vitro & In Vivo Diagnostic Substances
ABM,ABM Industries Incorporated Common Stock,50.15,0.92,1.869,United States,,Finance,Diversified Commercial Services
ABMD,ABIOMED Inc. Common Stock,294.6,-4.02,-1.346,United States,,Health Care,Medical/Dental Instruments
ABNB,Airbnb Inc. Class A Common Stock,183.87,-3.27,-1.747,United States,2020,Finance,Diversified Commercial Services
ABR,Arbor Realty Trust Common Stock,16.299,0.359,2.252,United States,2004,Consumer Services,Real Estate Investment Trusts
ABR^A,Arbor Realty Trust Preferred Series A,25.96,0.06,0.232,United States,,,
ABR^B,Arbor Realty Trust Cumulative Redeemable Preferred Series B,25.58,-0.0685,-0.267,United States,,,
ABR^C,Arbor Realty Trust Cumulative Redeemable Preferred Series C,25.86,-0.04,-0.154,United States,,,
ABST,Absolute Software Corporation Common Stock,14.3453,-0.0947,-0.656,Canada,2020,Technology,Computer Software: Prepackaged Software
ABT,Abbott Laboratories Common Stock,118.35,-2.14,-1.776,United States,,Health Care,Major Pharmaceuticals
ABTX,Allegiance Bancshares Inc. Common Stock,40.405,0.705,1.776,United States,2015,Finance,Major Banks
ABUS,Arbutus Biopharma Corporation Common Stock,3.455,0.065,1.917,Canada,,Health Care,Major Pharmaceuticals
AC,Associated Capital Group Inc. Common Stock,36.3,0.79,2.225,United States,2015,Finance,Investment Bankers/Brokers/Service
ACA,Arcosa Inc. Common Stock ,58.8,0.03,0.051,,2018,Capital Goods,Metal Fabrications
ACAC,Acies Acquisition Corp. Class A Ordinary Share,10.04,0.1,1.006,United States,2020,Technology,Computer Software: Prepackaged Software
ACACU,Acies Acquisition Corp. Unit,10.47,0.09,0.867,United States,2020,Technology,Computer Software: Prepackaged Software
ACACW,Acies Acquisition Corp. Warrant,1.65,-0.05,-2.941,United States,2020,Technology,Computer Software: Prepackaged Software
ACAD,ACADIA Pharmaceuticals Inc. Common Stock,25.6,-0.28,-1.082,United States,2004,Health Care,Major Pharmaceuticals
ACAHU,Atlantic Coastal Acquisition Corp. Unit,9.86,-0.06,-0.605,United States,2021,Finance,Business Services
ACB,Aurora Cannabis Inc. Common Shares,9.22,-0.1,-1.073,,2018,Consumer Durables,Specialty Chemicals
ACBI,Atlantic Capital Bancshares Inc. Common Stock,23.81,0.47,2.014,United States,,Finance,Major Banks
ACC,American Campus Communities Inc Common Stock,43.16,0.58,1.362,United States,2004,Consumer Services,Real Estate Investment Trusts
ACCD,Accolade Inc. Common Stock,39.14,-2.89,-6.876,United States,2020,,
ACCO,Acco Brands Corporation Common Stock,8.23,0.24,3.004,United States,,Consumer Durables,Publishing
ACEL,Accel Entertainment Inc. ,10.495,-0.045,-0.427,United States,2017,Consumer Services,Services-Misc. Amusement & Recreation
ACER,Acer Therapeutics Inc. Common Stock (DE),3.3985,-0.0815,-2.342,United States,,Health Care,Major Pharmaceuticals
ACET,Adicet Bio Inc. Common Stock ,13.96,-0.41,-2.853,United States,2018,Health Care,Major Pharmaceuticals
ACEV,ACE Convergence Acquisition Corp. Class A Ordinary Shares,9.9563,-0.1337,-1.325,United States,2020,Technology,Semiconductors
ACEVU,ACE Convergence Acquisition Corp. Unit,11.0899,0.0199,0.18,United States,2020,Technology,Semiconductors
ACEVW,ACE Convergence Acquisition Corp. Warrant,1.87,-0.41,-17.982,United States,2020,Technology,Semiconductors
ACGL,Arch Capital Group Ltd. Common Stock,37.56,0.79,2.148,Bermuda,,Finance,Property-Casualty Insurers
ACGLO,Arch Capital Group Ltd. Depositary Shares Each Representing 1/1000th Interest in a Share of 5.45 Non-Cumulative Preferred Shares Series F,26.3262,0.0362,0.138,Bermuda,,Finance,Property-Casualty Insurers
ACGLP,Arch Capital Group Ltd. Depositary Shares Representing Interest in 5.25 Non-Cumulative Preferred Series E Shrs,25.6633,0.1633,0.64,Bermuda,,Finance,Property-Casualty Insurers
ACH,Aluminum Corporation of China Limited American Depositary Shares,10.07,-0.57,-5.357,China,2001,Basic Industries,Aluminum
ACHC,Acadia Healthcare Company Inc. Common Stock,55.735,0.715,1.3,United States,,Health Care,Medical Specialities
ACHV,Achieve Life Sciences Inc. Common Shares,12.37,0.17,1.393,United States,,Health Care,Biotechnology: In Vitro & In Vivo Diagnostic Substances
ACI,Albertsons Companies Inc. Class A Common Stock,18.945,-0.415,-2.144,United States,2020,Consumer Services,Food Chains
ACIC,Atlas Crest Investment Corp. Class A Common Stock,10.095,-0.245,-2.369,United States,2020,Finance,Business Services
ACIU,AC Immune SA Common Stock,7.77,0.1,1.304,Switzerland,2016,Health Care,Major Pharmaceuticals
ACIW,ACI Worldwide Inc. Common Stock,37.5,0.3,0.806,United States,,Technology,Computer Software: Prepackaged Software
ACKIT,Ackrell SPAC Partners I Co. Subunits,9.9,0.01,0.101,United States,2021,Finance,Business Services
ACKIU,Ackrell SPAC Partners I Co. Units,10.16,0.01,0.099,United States,2020,Finance,Business Services
ACKIW,Ackrell SPAC Partners I Co. Warrants,0.6301,0.0099,1.596,United States,2021,Finance,Business Services
ACLS,Axcelis Technologies Inc. Common Stock,37.424,1.234,3.41,United States,2000,Technology,Industrial Machinery/Components
ACM,AECOM Common Stock,61.94,1.65,2.737,United States,2007,Consumer Services,Military/Government/Technical
ACMR,ACM Research Inc. Class A Common Stock,86.5,-4,-4.42,United States,2017,Technology,Industrial Machinery/Components
ACN,Accenture plc Class A Ordinary Shares (Ireland),268.56,2.53,0.951,Ireland,2001,Miscellaneous,Business Services
ACNB,ACNB Corporation Common Stock,30.07,1.07,3.69,United States,,Finance,Major Banks
ACND,Ascendant Digital Acquisition Corp. Class A Ordinary Shares,9.82,-0.06,-0.607,United States,2020,Finance,Business Services
ACOR,Acorda Therapeutics Inc. Common Stock,5.28,-0.05,-0.938,United States,2006,Health Care,Biotechnology: Biological Products (No Diagnostic Substances)
ACP,Aberdeen Income Credit Strategies Fund Common Shares,11.7,-0.01,-0.085,United States,2011,,
ACQRU,Independence Holdings Corp. Units,10.075,-0.005,-0.05,United States,2021,Finance,Business Services
ACR,ACRES Commercial Realty Corp. Common Stock,15.9,0.69,4.536,United States,,Consumer Services,Real Estate Investment Trusts
ACR^C,ACRES Commercial Realty Corp. 8.625 Fixed-to-Floating Series C Cumulative Redeemable Preferred Stock ,25.3,0.1,0.397,United States,,,
ACRE,Ares Commercial Real Estate Corporation Common Stock,14.33,0.44,3.168,United States,2012,Consumer Services,Real Estate Investment Trusts
ACRS,Aclaris Therapeutics Inc. Common Stock,23.9,-1.43,-5.645,United States,2015,Health Care,Major Pharmaceuticals
ACRX,AcelRx Pharmaceuticals Inc. Common Stock,1.71,-0.05,-2.841,United States,2011,Health Care,Major Pharmaceuticals
ACST,Acasti Pharma Inc. Class A Common Stock,0.62,-0.0415,-6.274,Canada,,Health Care,Major Pharmaceuticals
ACTC,ArcLight Clean Transition Corp. Class A Ordinary Shares,16.3862,-0.3138,-1.879,United States,2020,Capital Goods,Auto Manufacturing
ACTCU,ArcLight Clean Transition Corp. Unit,19,-1,-5,United States,2020,Capital Goods,Auto Manufacturing
ACTCW,ArcLight Clean Transition Corp. Warrant,5.2,-0.313,-5.677,United States,2020,Capital Goods,Auto Manufacturing
ACTDU,ArcLight Clean Transition Corp. II Unit,9.98,-0.03,-0.3,United States,2021,Finance,Business Services
ACTG,Acacia Research Corporation (Acacia Tech) Common Stock,5.725,0.045,0.792,United States,,Miscellaneous,Multi-Sector Companies
ACU,Acme United Corporation. Common Stock,39.5,-0.41,-1.027,United States,1988,Capital Goods,Industrial Machinery/Components
ACV,Virtus AllianzGI Diversified Income & Convertible Fund Common Shares of Beneficial Interest,30.8,-0.3,-0.965,United States,2015,,
ACVA,ACV Auctions Inc. Class A Common Stock,33.5,8.5,34,United States,,,
ACY,AeroCentury Corp. Common Stock,7.67,-0.33,-4.125,United States,,Technology,Diversified Commercial Services
ADAG,Adagene Inc. American Depositary Shares,17.6299,-1.1001,-5.873,China,2021,Health Care,Major Pharmaceuticals
ADAP,Adaptimmune Therapeutics plc American Depositary Shares,5.2,-0.18,-3.346,United Kingdom,2015,Health Care,Biotechnology: Biological Products (No Diagnostic Substances)
ADBE,Adobe Inc. Common Stock,453.47,-6.73,-1.462,United States,1986,Technology,Computer Software: Prepackaged Software
ADC,Agree Realty Corporation Common Stock,67.31,0.75,1.127,United States,,Consumer Services,Real Estate Investment Trusts
ADCT,ADC Therapeutics SA Common Shares,23.53,-4.34,-15.572,,2020,Health Care,Major Pharmaceuticals
ADER,26 Capital Acquisition Corp. Class A Common Stock,9.6279,-0.0721,-0.743,United States,2021,Finance,Business Services
ADERU,26 Capital Acquisition Corp. Unit,10.02,-0.09,-0.89,United States,2021,Finance,Business Services
ADERW,26 Capital Acquisition Corp. Warrant,0.8199,-0.0801,-8.9,United States,2021,Finance,Business Services
ADES,Advanced Emissions Solutions Inc. Common Stock,5.44,0.17,3.226,United States,,Basic Industries,Major Chemicals
ADEX,Adit EdTech Acquisition Corp. Common Stock,9.62,-0.02,-0.207,,2021,Finance,Business Services
ADFI,Anfield Dynamic Fixed Income ETF,9.65,0,0,,2020,,
ADI,Analog Devices Inc. Common Stock,153.07,2.58,1.714,United States,,Technology,Semiconductors
ADIL,Adial Pharmaceuticals Inc Common Stock,2.3651,-0.0649,-2.671,United States,2018,Health Care,Major Pharmaceuticals
ADILW,Adial Pharmaceuticals Inc Warrant,0.61,-0.01,-1.613,United States,2018,Health Care,Major Pharmaceuticals
ADM,Archer-Daniels-Midland Company Common Stock,56.48,0.92,1.656,United States,,Consumer Non-Durables,Packaged Foods
ADMA,ADMA Biologics Inc Common Stock,2.0009,-0.0491,-2.395,United States,,Health Care,Biotechnology: Biological Products (No Diagnostic Substances)
ADME,Aptus Drawdown Managed Equity ETF,36.05,0.14,0.39,United States,2016,,
ADMP,Adamis Pharmaceuticals Corporation Common Stock,0.9371,-0.0362,-3.719,United States,,Health Care,Major Pharmaceuticals
ADMS,Adamas Pharmaceuticals Inc. Common Stock,5.19,-0.07,-1.331,United States,2014,Health Care,Major Pharmaceuticals
ADN,Advent Technologies Holdings Inc. Class A Common Stock,15.68,1.12,7.692,United States,2018,Miscellaneous,Industrial Machinery/Components
ADNT,Adient plc Ordinary Shares ,38.595,-0.035,-0.091,,2016,Capital Goods,Auto Parts:O.E.M.
ADNWW,Advent Technologies Holdings Inc. Warrant,2.96,0.41,16.078,United States,2018,Miscellaneous,Industrial Machinery/Components
ADOC,Edoc Acquisition Corp. Class A Ordinary Share,9.9534,-0.0066,-0.066,United States,2020,Finance,Business Services
ADOCR,Edoc Acquisition Corp. Right,0.38,-0.0199,-4.976,United States,2020,Finance,Business Services
ADOCW,Edoc Acquisition Corp. Warrant,0.38,-0.015,-3.797,United States,2020,Finance,Business Services
ADP,Automatic Data Processing Inc. Common Stock,186.265,2.225,1.209,United States,,Technology,EDP Services
ADPT,Adaptive Biotechnologies Corporation Common Stock,40.03,-1.93,-4.6,United States,2019,Health Care,Biotechnology: Biological Products (No Diagnostic Substances)
ADRA,Adara Acquisition Corp.,9.75,9.75,,United States,,,
ADS,Alliance Data Systems Corporation Common Stock,109.33,3.79,3.591,United States,2001,Miscellaneous,Business Services
ADSK,Autodesk Inc. Common Stock,267.75,-1.25,-0.465,United States,,Technology,Computer Software: Prepackaged Software
ADT,ADT Inc. Common Stock,7.83,0.05,0.643,United States,2018,Consumer Services,Diversified Commercial Services
ADTN,ADTRAN Inc. Common Stock,16.635,0.045,0.271,United States,1994,Public Utilities,Telecommunications Equipment
ADTX,ADiTx Therapeutics Inc. Common Stock,2.9495,-0.2005,-6.365,United States,2020,Health Care,Major Pharmaceuticals
ADUS,Addus HomeCare Corporation Common Stock,106.43,-1.26,-1.17,United States,2009,Health Care,Medical/Nursing Services
ADV,Advantage Solutions Inc. Class A Common Stock,11.582,-0.138,-1.177,United States,2019,Miscellaneous,Business Services
ADVM,Adverum Biotechnologies Inc. Common Stock,9.62,-0.235,-2.385,United States,2014,Health Care,Biotechnology: Biological Products (No Diagnostic Substances)
ADVWW,Advantage Solutions Inc. Warrant,2.83,-0.17,-5.667,United States,2019,Miscellaneous,Business Services
ADX,Adams Diversified Equity Fund Inc.,18.01,0.03,0.167,United States,,,
ADXN,Addex Therapeutics Ltd American Depositary Shares,10.3262,0.5062,5.155,Switzerland,,Health Care,Major Pharmaceuticals
ADXS,Advaxis Inc. Common Stock,0.7945,-0.0155,-1.914,United States,,Health Care,Major Pharmaceuticals
AE,Adams Resources & Energy Inc. Common Stock,30.73,-0.56,-1.79,United States,,Energy,Oil Refining/Marketing
AEAC,Authentic Equity Acquisition Corp. Class A ordinary share,9.67,0.02,0.207,United States,2021,Finance,Business Services
AEACU,Authentic Equity Acquisition Corp. Unit,9.95,-0.04,-0.4,United States,2021,Finance,Business Services
AEACW,Authentic Equity Acquisition Corp. Warrant,0.6601,-0.0399,-5.7,United States,2021,Finance,Business Services
AEB,AEGON N.V. Perp. Cap. Secs. Floating Rate (Netherlands),25.24,0.14,0.558,Netherlands,,Finance,Life Insurance
AEE,Ameren Corporation Common Stock,80.51,0.53,0.663,United States,,Public Utilities,Power Generation
AEF,Aberdeen Emerging Markets Equity Income Fund Inc. Common Stock,8.43,-0.09,-1.056,United States,,,
AEFC,Aegon Funding Company LLC 5.10 Subordinated Notes due 2049,26.128,0.298,1.154,,2019,Finance,Life Insurance
AEG,AEGON N.V. Common Stock,4.605,0.105,2.333,Netherlands,,Finance,Life Insurance
AEGN,Aegion Corp Common Stock,28.79,-0.21,-0.724,United States,,Basic Industries,Water Supply
AEHL,Antelope Enterprise Holdings Limited Common Stock (0.024 par),3.7,0.59,18.971,China,,Capital Goods,Building Materials
AEHR,Aehr Test Systems Common Stock,2.44,-0.02,-0.813,United States,1997,Capital Goods,Electrical Products
AEI,Alset EHome International Inc. Common Stock,10.87,0.04,0.369,United States,2020,Finance,Real Estate
AEIS,Advanced Energy Industries Inc. Common Stock,105.14,4.77,4.752,United States,1995,Capital Goods,Industrial Machinery/Components
AEL,American Equity Investment Life Holding Company Common Stock,29.56,0.23,0.784,United States,2003,Finance,Life Insurance
AEL^A,American Equity Investment Life Holding Company Depositary Shares each representing a 1/1000th interest in a share of 5.95 Fixed-Rate Reset Non-Cumulative Preferred Stock Series A,26.1623,0.1423,0.547,United States,,,
AEL^B,American Equity Investment Life Holding Company Depositary Shares each representing a 1/1000th interest in a share of 6.625 Fixed-Rate Reset Non-Cumulative Preferred Stock Series B,27.4125,0.2645,0.974,United States,,,
AEM,Agnico Eagle Mines Limited Common Stock,59.22,-0.06,-0.101,Canada,,Basic Industries,Precious Metals
AEMD,Aethlon Medical Inc. Common Stock,1.96,-0.04,-2,United States,,Health Care,Medical/Dental Instruments
AENZ,Aenza S.A.A. American Depositary Shares,2.23,0.055,2.529,,2018,Basic Industries,Military/Government/Technical
AEO,American Eagle Outfitters Inc. Common Stock,27.32,0.2,0.737,United States,,Consumer Services,Clothing/Shoe/Accessory Stores
AEP,American Electric Power Company Inc. Common Stock,84.79,0.15,0.177,United States,,Public Utilities,Electric Utilities: Central
AEPPL,American Electric Power Company Inc. Corporate Unit,48.48,0.15,0.31,United States,,Public Utilities,Electric Utilities: Central
AEPPZ,American Electric Power Company Inc. Corporate Units,49.31,0.35,0.715,United States,,Public Utilities,Electric Utilities: Central
AER,AerCap Holdings N.V. Ordinary Shares,57.88,1.16,2.045,Netherlands,2006,Technology,Diversified Commercial Services
AERI,Aerie Pharmaceuticals Inc. Common Stock,18.8,-0.12,-0.634,United States,2013,Health Care,Biotechnology: Biological Products (No Diagnostic Substances)
AES,The AES Corporation Common Stock,26.075,0.495,1.935,United States,,Basic Industries,Electric Utilities: Central
AESC,The AES Corporation Corporate Units,101.01,0.82,0.818,United States,,Basic Industries,Electric Utilities: Central
AESE,Allied Esports Entertainment Inc. Common Stock,3.3906,0.0306,0.911,United States,2017,Consumer Services,Services-Misc. Amusement & Recreation
AESR,Anfield U.S. Equity Sector Rotation ETF,12.45,0.0727,0.587,,2019,,
AEVA,Aeva Technologies Inc. Common Stock,13.02,-0.96,-6.867,,2020,Capital Goods,Auto Parts:O.E.M.
AEY,ADDvantage Technologies Group Inc. Common Stock,2.71,-0.01,-0.368,United States,,Consumer Services,Office Equipment/Supplies/Services
AEYE,AudioEye Inc. Common Stock,27.9,-2.11,-7.031,United States,,Technology,Computer Software: Prepackaged Software
AEZS,Aeterna Zentaris Inc. Common Stock,1.16,-0.02,-1.695,Canada,,Health Care,Major Pharmaceuticals
AFAQU,AF Acquisition Corp. Units,9.8,0.03,0.307,United States,2021,Finance,Business Services
AFB,AllianceBernstein National Municipal Income Fund Inc,14.17,0.05,0.354,United States,2002,,
AFBI,Affinity Bancshares Inc. Common Stock (MD),11.96,-0.14,-1.157,United States,2017,Finance,Savings Institutions
AFC,Allied Capital Corporation Allied Capital Corporation 6.875 Notes due April 15 2047,25.33,0.01,0.039,United States,,,
AFCG,AFC Gamma Inc. Common Stock,20.85,-0.35,-1.651,United States,2021,Finance,Real Estate
AFG,American Financial Group Inc. Common Stock,115.83,2.3,2.026,United States,,Finance,Property-Casualty Insurers
AFGB,American Financial Group Inc. 5.875 Subordinated Debentures due 2059,27.2856,0.0856,0.315,United States,2019,Finance,Property-Casualty Insurers
AFGC,American Financial Group Inc. 5.125 Subordinated Debentures due 2059,26.42,-0.15,-0.565,United States,2019,Finance,Property-Casualty Insurers
AFGD,American Financial Group Inc. 5.625 Subordinated Debentures due 2060,27.6289,0.0689,0.25,United States,2020,Finance,Property-Casualty Insurers
AFGE,American Financial Group Inc. 4.500 Subordinated Debentures due 2060,26.29,0.16,0.612,United States,2020,Finance,Property-Casualty Insurers
AFI,Armstrong Flooring Inc. Common Stock,5.23,0.2,3.976,,2016,Consumer Non-Durables,Plastic Products
AFIB,Acutus Medical Inc. Common Stock,14.07,-0.68,-4.61,United States,2020,Health Care,Medical/Dental Instruments
AFIN,American Finance Trust Inc. Class A Common Stock,9.94,0.42,4.412,United States,,Consumer Services,Real Estate Investment Trusts
AFINO,American Finance Trust Inc. 7.375 Series C Cumulative Redeemable Preferred Stock,25.005,0.005,0.02,United States,,Consumer Services,Real Estate Investment Trusts
AFINP,American Finance Trust Inc. 7.50 Series A Cumulative Redeemable Perpetual Preferred Stock,25.52,-0.07,-0.274,United States,,Consumer Services,Real Estate Investment Trusts
AFL,AFLAC Incorporated Common Stock,50.33,0.83,1.677,United States,,Finance,Accident &Health Insurance
AFMD,Affimed N.V.,8.03,-0.01,-0.124,Germany,2014,Health Care,Major Pharmaceuticals
AFRM,Affirm Holdings Inc. Class A Common Stock,75.52,-3.35,-4.247,United States,2021,Miscellaneous,Business Services
AFT,Apollo Senior Floating Rate Fund Inc. Common Stock,14.83,0.04,0.27,,2011,,
AFYA,Afya Limited Class A Common Shares,19.68,-0.26,-1.304,Brazil,2019,Consumer Services,Other Consumer Services
AG,First Majestic Silver Corp. Ordinary Shares (Canada),15.9,0.05,0.315,Canada,,Basic Industries,Precious Metals
AGBA,AGBA Acquisition Limited Ordinary Share,10.54,-0.02,-0.189,Hong Kong,2019,Finance,Business Services
AGBAR,AGBA Acquisition Limited Right,0.2601,-0.0413,-13.703,Hong Kong,2019,Finance,Business Services
AGBAU,AGBA Acquisition Limited Unit,12.2,0.8,7.018,Hong Kong,2019,Finance,Business Services
AGBAW,AGBA Acquisition Limited Warrant,0.34,-0.01,-2.857,Hong Kong,2019,Finance,Business Services
AGC,Altimeter Growth Corp. Class A Ordinary Shares,12,-0.45,-3.614,United States,2020,Finance,Business Services
AGCB,Altimeter Growth Corp. 2 Class A Ordinary Shares,10.6,-0.05,-0.469,,2021,Finance,Business Services
AGCO,AGCO Corporation Common Stock,139.08,3.89,2.877,United States,,Capital Goods,Industrial Machinery/Components
AGCUU,Altimeter Growth Corp. Unit,12.94,-0.49,-3.649,United States,2020,Finance,Business Services
AGCWW,Altimeter Growth Corp. Warrant,4.31,-0.09,-2.045,United States,2020,Finance,Business Services
AGD,Aberdeen Global Dynamic Dividend Fund,11.01,0.08,0.732,United States,2006,,
AGE,AgeX Therapeutics Inc. Common Stock,1.63,-0.25,-13.298,,2018,Health Care,Major Pharmaceuticals
AGEN,Agenus Inc. Common Stock,2.85,-0.15,-5,United States,2000,Health Care,Biotechnology: Biological Products (No Diagnostic Substances)
AGFS,AgroFresh Solutions Inc. Common Stock,2.1879,0.1329,6.467,United States,2014,Basic Industries,Agricultural Chemicals
AGFY,Agrify Corporation Common Stock,12.94,1.05,8.831,United States,2021,Consumer Non-Durables,Farming/Seeds/Milling
AGGRU,Agile Growth Corp. Units,9.82,0.03,0.306,United States,2021,Finance,Business Services
AGI,Alamos Gold Inc. Class A Common Shares,7.86,-0.11,-1.38,Canada,2015,Basic Industries,Precious Metals
AGIO,Agios Pharmaceuticals Inc. Common Stock,48.82,-2.24,-4.387,United States,2013,Health Care,Major Pharmaceuticals
AGLE,Aeglea BioTherapeutics Inc. Common Stock,7.77,-0.74,-8.696,United States,2016,Health Care,Major Pharmaceuticals
AGM,Federal Agricultural Mortgage Corporation Common Stock,96.8,1.66,1.745,United States,,Finance,Finance Companies
AGM^C,Federal Agricultural Mortgage Corporation Preferred Series C Fixed to Fltg,26.99,-0.0529,-0.196,United States,,,
AGM^D,Federal Agricultural Mortgage Corporation 5.700 Non-Cumulative Preferred Stock Series D,26.98,0.0367,0.136,United States,,,
AGM^E,Federal Agricultural Mortgage Corporation 5.750 Non-Cumulative Preferred Stock Series E,27.19,0.01,0.037,United States,,,
AGM^F,Federal Agricultural Mortgage Corporation 5.250 Non-Cumulative Preferred Stock Series F,26.01,-0.265,-1.009,United States,,,
AGMH,AGM Group Holdings Inc. Class A Ordinary Shares,14.1039,-0.0761,-0.537,Hong Kong,2018,Technology,EDP Services
AGNC,AGNC Investment Corp. Common Stock,16.7376,0.1776,1.072,United States,2008,Consumer Services,Real Estate Investment Trusts
AGNCM,AGNC Investment Corp. Depositary Shares rep 6.875 Series D Fixed-to-Floating Cumulative Redeemable Preferred Stock,25.59,0.05,0.196,United States,,Consumer Services,Real Estate Investment Trusts
AGNCN,AGNC Investment Corp. Depositary Shares Each Representing a 1/1000th Interest in a Share of 7.00 Series C Fixed-To-Floating Rate Cumulative Redeemable Preferred Stock,25.85,-0.1299,-0.5,United States,,Consumer Services,Real Estate Investment Trusts
AGNCO,AGNC Investment Corp. Depositary Shares each representing a 1/1000th interest in a share of 6.50 Series E Fixed-to-Floating Cumulative Redeemable Preferred Stock,24.66,0.04,0.162,United States,,Consumer Services,Real Estate Investment Trusts
