Symbol,Name,Last_Sale,Net_Change,Change,Country,IPO_Year,Sector,Industry
CURIW,CuriosityStream Inc. Warrant,5.8,-0.935,-13.883,United States,2020,Consumer Services,Movies/Entertainment
CURO,CURO Group Holdings Corp. Common Stock,14.3,0.06,0.421,,2017,Finance,Finance: Consumer Services
CUTR,Cutera Inc. Common Stock,30.3,-0.47,-1.527,United States,2004,Health Care,Biotechnology: Electromedical & Electrotherapeutic Apparatus
CUZ,Cousins Properties Incorporated Common Stock,35.32,1.1,3.214,United States,,Consumer Services,Real Estate Investment Trusts
CVA,Covanta Holding Corporation Common Stock,13.75,0.25,1.852,United States,,Basic Industries,Electric Utilities: Central
CVAC,CureVac N.V. Ordinary Shares,86.31,-1.99,-2.254,Germany,2020,Health Care,Major Pharmaceuticals
CVBF,CVB Financial Corporation Common Stock,22.535,0.435,1.968,United States,,Finance,Major Banks
CVCO,Cavco Industries Inc. Common Stock When Issued,219.01,-1.63,-0.739,United States,,Basic Industries,Homebuilding
CVCY,Central Valley Community Bancorp Common Stock,18.325,0.035,0.191,United States,,Finance,Major Banks
CVE,Cenovus Energy Inc Common Stock,7.815,0.365,4.899,Canada,,Energy,Oil & Gas Production
CVEO,Civeo Corporation (Canada) Common Shares,15.31,0.33,2.203,,2014,Consumer Services,Hotels/Resorts
CVET,Covetrus Inc. Common Stock,31.06,-0.22,-0.703,United States,,Health Care,Medical/Nursing Services
CVGI,Commercial Vehicle Group Inc. Common Stock,10.0134,-0.0566,-0.562,United States,2004,Capital Goods,Auto Parts:O.E.M.
CVGW,Calavo Growers Inc. Common Stock,75.38,0.54,0.722,United States,,Consumer Non-Durables,Farming/Seeds/Milling
CVI,CVR Energy Inc. Common Stock,20.87,0.75,3.728,United States,2007,Energy,Integrated oil Companies
CVLG,Covenant Logistics Group Inc. Class A Common Stock,19.54,0.57,3.005,United States,,Transportation,Trucking Freight/Courier Services
CVLT,Commvault Systems Inc. Common Stock,63.725,-1.035,-1.598,United States,2006,Technology,Computer Software: Prepackaged Software
CVLY,Codorus Valley Bancorp Inc Common Stock,18.595,0.345,1.89,United States,,Finance,Savings Institutions
CVM,Cel-Sci Corporation Common Stock,17.48,0.48,2.824,United States,,Health Care,Biotechnology: Biological Products (No Diagnostic Substances)
CVNA,Carvana Co. Class A Common Stock,259.43,-14.74,-5.376,United States,2017,Consumer Durables,Automotive Aftermarket
CVR,Chicago Rivet & Machine Co. Common Stock,25.16,-0.9856,-3.77,United States,,Technology,Industrial Machinery/Components
CVS,CVS Health Corporation Common Stock,73.865,1.965,2.733,United States,,Health Care,Medical/Nursing Services
CVU,CPI Aerostructures Inc. Common Stock,4.55,0.09,2.018,United States,,Capital Goods,Military/Government/Technical
CVV,CVD Equipment Corporation Common Stock,4.47,0.15,3.472,United States,,Technology,Industrial Machinery/Components
CVX,Chevron Corporation Common Stock,105.3172,3.3472,3.283,United States,,Energy,Integrated oil Companies
CW,Curtiss-Wright Corporation Common Stock,116.46,3.15,2.78,United States,,Technology,Industrial Machinery/Components
CWBC,Community West Bancshares Common Stock,12.92,0.32,2.54,United States,,Finance,Major Banks
CWBR,CohBar Inc. Common Stock,1.39,-0.09,-6.081,United States,,Health Care,Major Pharmaceuticals
CWCO,Consolidated Water Co. Ltd. Ordinary Shares,13.5,0.17,1.275,Cayman Islands,,Public Utilities,Water Supply
CWEN,Clearway Energy Inc. Class C Common Stock,26.261,-0.069,-0.262,United States,2015,Public Utilities,Electric Utilities: Central
CWH,Camping World Holdings Inc. Class A Commom Stock,36.405,-1.375,-3.639,United States,2016,Consumer Durables,Automotive Aftermarket
CWK,Cushman & Wakefield plc Ordinary Shares,15.94,-0.18,-1.117,,2018,Finance,Real Estate
CWST,Casella Waste Systems Inc. Class A Common Stock,64.88,1.47,2.318,United States,1997,Public Utilities,Environmental Services
CWT,California Water Service Group Common Stock,54.89,-0.03,-0.055,United States,,Public Utilities,Water Supply
CX,Cemex S.A.B. de C.V. Sponsored ADR,6.405,0.025,0.392,Mexico,,Capital Goods,Building Materials
CXDC,China XD Plastics Company Limited Common Stock,1.08,-0.02,-1.818,China,,Capital Goods,Containers/Packaging
CXDO,Crexendo Inc. Common Stock,6.54,-0.11,-1.654,United States,,Public Utilities,Telecommunications Equipment
CXE,MFS High Income Municipal Trust Common Stock,4.99,-0.02,-0.399,United States,1989,,
CXH,MFS Investment Grade Municipal Trust Common Stock,9.6701,-0.0175,-0.181,United States,1989,,
CXP,Columbia Property Trust Inc. Common Stock,17.5,0.5,2.941,United States,2013,Consumer Services,Real Estate Investment Trusts
CXW,CoreCivic Inc. Common Stock,8.82,0.34,4.009,United States,,Consumer Services,Real Estate Investment Trusts
CYAD,Celyad Oncology SA American Depositary Shares,7.49,0.0265,0.355,Belgium,2015,Health Care,Major Pharmaceuticals
CYAN,Cyanotech Corporation Common Stock,3.38,-0.17,-4.789,United States,,Consumer Durables,Specialty Chemicals
CYBE,CyberOptics Corporation Common Stock,24.64,0.63,2.624,United States,1987,Capital Goods,Electronic Components
CYBR,CyberArk Software Ltd. Ordinary Shares,135.96,-3.36,-2.412,Israel,2014,Technology,Computer Software: Prepackaged Software
CYCC,Cyclacel Pharmaceuticals Inc. Common Stock,7.448,-0.282,-3.648,United States,,Health Care,Major Pharmaceuticals
CYCCP,Cyclacel Pharmaceuticals Inc. 6 Convertible Preferred Stock,7.31,-0.5581,-7.093,United States,,Health Care,Major Pharmaceuticals
CYCN,Cyclerion Therapeutics Inc. Common Stock,3.465,-0.065,-1.841,United States,,Health Care,Major Pharmaceuticals
CYD,China Yuchai International Limited Common Stock,15.47,0.13,0.847,Singapore,1994,Energy,Industrial Machinery/Components
CYH,Community Health Systems Inc. Common Stock,12.09,0.57,4.948,United States,2000,Health Care,Hospital/Nursing Management
CYRN,CYREN Ltd. Ordinary Shares,0.8753,-0.006,-0.681,United States,,Technology,Computer Software: Prepackaged Software
CYRX,CryoPort Inc. Common Stock,49.88,-3.46,-6.487,United States,,Health Care,Major Pharmaceuticals
CYTH,Cyclo Therapeutics Inc. Common Stock,11.66,0.61,5.52,United States,,Basic Industries,Major Chemicals
CYTHW,Cyclo Therapeutics Inc. Warrant,6.48,-0.52,-7.429,United States,,Basic Industries,Major Chemicals
CYTK,Cytokinetics Incorporated Common Stock,23.1,-0.59,-2.491,United States,2004,Health Care,Major Pharmaceuticals
CZNC,Citizens & Northern Corp Common Stock,23.35,0.45,1.965,United States,,Finance,Major Banks
CZR,Caesars Entertainment Inc. Common Stock,86.58,1.99,2.353,United States,,Consumer Services,Hotels/Resorts
CZWI,Citizens Community Bancorp Inc. Common Stock,12.78,-0.02,-0.156,United States,,Finance,Savings Institutions
D,Dominion Energy Inc. Common Stock,74.16,-0.02,-0.027,United States,,Public Utilities,Electric Utilities: Central
DAC,Danaos Corporation Common Stock,51.67,4.2,8.848,Greece,2006,Transportation,Marine Transportation
DADA,Dada Nexus Limited American Depositary Shares,28.09,-3.82,-11.971,China,2020,Technology,Computer Software: Programming Data Processing
DAIO,Data I/O Corporation Common Stock,5.3706,-0.3494,-6.108,United States,1981,Capital Goods,Electrical Products
DAKT,Daktronics Inc. Common Stock,6.12,0.04,0.658,United States,1994,Consumer Durables,Miscellaneous manufacturing industries
DAL,Delta Air Lines Inc. Common Stock,46.84,1.2,2.629,United States,,Transportation,Air Freight/Delivery Services
DAN,Dana Incorporated Common Stock ,23.575,0.295,1.267,United States,,Capital Goods,Auto Parts:O.E.M.
DAO,Youdao Inc. American Depositary Shares each representing one Class A Ordinary Share,29.05,-1.29,-4.252,,2019,Consumer Services,Other Consumer Services
DAR,Darling Ingredients Inc. Common Stock,71.08,2.16,3.134,United States,,Consumer Non-Durables,Packaged Foods
DARE,Dare Bioscience Inc. Common Stock,1.89,-0.05,-2.577,United States,2014,Health Care,Major Pharmaceuticals
DASH,DoorDash Inc. Class A Common Stock,127.85,-3.91,-2.968,,2020,Miscellaneous,Business Services
DAUG,FT Cboe Vest U.S. Equity Deep Buffer ETF - August,33.6727,0.0727,0.216,United States,2019,,
DAVA,Endava plc American Depositary Shares (each representing one Class A Ordinary Share),82.75,-3.06,-3.566,,2018,Technology,EDP Services
DB,Deutsche Bank AG Common Stock,12.51,0.22,1.79,Germany,,Finance,Major Banks
DBD,Diebold Nixdorf Incorporated Common Stock,14.29,0.67,4.919,United States,,Miscellaneous,Office Equipment/Supplies/Services
DBDR,Roman DBDR Tech Acquisition Corp. Class A Common Stock,9.95,0.03,0.302,United States,2020,Finance,Business Services
DBDRU,Roman DBDR Tech Acquisition Corp. Unit,10.2894,-0.0806,-0.777,United States,2020,Finance,Business Services
DBDRW,Roman DBDR Tech Acquisition Corp. Warrant,0.988,-0.012,-1.2,United States,2020,Finance,Business Services
DBI,Designer Brands Inc. Class A Common Stock,13.79,-1.59,-10.338,United States,,Consumer Services,Clothing/Shoe/Accessory Stores
DBL,DoubleLine Opportunistic Credit Fund Common Shares of Beneficial Interest,19.97,0.01,0.05,United States,2012,,
DBOC,Innovator Double Stacker 9 Buffer ETF - October,27.704,0,0,,2020,,
DBTX,Decibel Therapeutics Inc. Common Stock,13.03,-1.38,-9.577,United States,2021,Health Care,Major Pharmaceuticals
DBVT,DBV Technologies S.A. American Depositary Shares,5.5,-0.02,-0.362,France,2014,Health Care,Biotechnology: Biological Products (No Diagnostic Substances)
DBX,Dropbox Inc. Class A Common Stock,27.02,-0.33,-1.207,United States,2018,Technology,Computer Software: Prepackaged Software
DCBO,Docebo Inc. Common Shares,39.78,-1.85,-4.444,Canada,,Technology,Computer Software: Prepackaged Software
DCF,BNY Mellon Alcentra Global Credit Income 2024 Target Term Fund Inc. Common Stock,9.31,0.02,0.215,,2017,,
DCI,Donaldson Company Inc. Common Stock,58.155,0.885,1.545,United States,,Capital Goods,Pollution Control Equipment
DCO,Ducommun Incorporated Common Stock,56.48,3.24,6.086,United States,,Capital Goods,Military/Government/Technical
DCOM,Dime Community Bancshares Inc. Common Stock,30.52,0.57,1.903,United States,,Finance,Savings Institutions
DCOMP,Dime Community Bancshares Inc. Fixed-Rate Non-Cumulative Perpetual Preferred Stock Series A,25.15,0,0,United States,,Finance,Major Banks
DCP,DCP Midstream  LP Common Units ,21.61,0.36,1.694,United States,,Public Utilities,Natural Gas Distribution
DCP^B,DCP Midstream LP 7.875 Series B Fixed-to-Floating Rate Cumulative Redeemable Perpetual Preferred Units,23.9932,-0.0068,-0.028,United States,,,
DCP^C,DCP Midstream LP 7.95 Series C Fixed-to-Floating Rate Cumulative Redeemable Perpetual Preferred Units,23.985,0.215,0.905,United States,,,
DCPH,Deciphera Pharmaceuticals Inc. Common Stock,43.635,0.055,0.126,United States,2017,Health Care,Major Pharmaceuticals
DCRB,Decarbonization Plus Acquisition Corporation Class A Common Stock,10.52,-0.23,-2.14,United States,2020,Finance,Business Services
DCRBU,Decarbonization Plus Acquisition Corporation Unit,11.54,-0.11,-0.944,United States,2020,Finance,Business Services
DCRBW,Decarbonization Plus Acquisition Corporation Warrant,1.8899,-0.2401,-11.272,United States,2020,Finance,Business Services
DCRCU,Decarbonization Plus Acquisition Corporation III Unit,9.88,-0.12,-1.2,United States,,,
DCRNU,Decarbonization Plus Acquisition Corporation II Unit,9.975,-0.025,-0.25,United States,2021,Finance,Business Services
DCT,Duck Creek Technologies Inc. Common Stock,41.875,-0.775,-1.817,United States,2020,Technology,Computer Software: Prepackaged Software
DCTH,Delcath Systems Inc. Common Stock,17.84,-0.15,-0.834,United States,,Health Care,Medical/Dental Instruments
DCUE,Dominion Energy Inc. 2019 Series A Corporate Units,97.5106,-0.0494,-0.051,United States,2019,Public Utilities,Electric Utilities: Central
DD,DuPont de Nemours Inc. Common Stock,77.07,1.75,2.323,,2017,Basic Industries,Major Chemicals
DDD,3D Systems Corporation Common Stock,26.065,-0.155,-0.591,United States,,Technology,Computer Software: Prepackaged Software
DDEC,FT Cboe Vest U.S. Equity Deep Buffer ETF - December,31.0198,0.0745,0.241,United States,2020,,
DDF,Delaware Investments Dividend & Income Fund Inc. Common Stock,10.01,0.03,0.301,United States,1993,,
DDMX,DD3 Acquisition Corp. II Class A Common Stock,9.84,0.07,0.716,Mexico,2021,Finance,Business Services
DDMXU,DD3 Acquisition Corp. II Unit,10.36,-0.14,-1.333,Mexico,2020,Finance,Business Services
DDMXW,DD3 Acquisition Corp. II Warrant,1.2001,-0.0499,-3.992,Mexico,2021,Finance,Business Services
DDOG,Datadog Inc. Class A Common Stock,81.86,-3.31,-3.886,United States,2019,Technology,Computer Software: Prepackaged Software
DDS,Dillard's Inc. Common Stock,90.35,1.11,1.244,United States,,Consumer Services,Department/Specialty Retail Stores
DDT,Dillard's Capital Trust I,25.775,-0.055,-0.213,United States,,Consumer Services,Department/Specialty Retail Stores
DE,Deere & Company Common Stock,366.436,8.946,2.502,United States,,Capital Goods,Industrial Machinery/Components
DEA,Easterly Government Properties Inc. Common Stock,21.245,0.245,1.167,United States,2015,Consumer Services,Real Estate Investment Trusts
DECK,Deckers Outdoor Corporation Common Stock,318.26,-0.37,-0.116,United States,1993,Consumer Non-Durables,Shoe Manufacturing
DECZ,TrueShares Structured Outcome (December) ETF,26.3005,-0.1674,-0.632,United States,2020,,
DEFN,Emles Trust Emles Protective Allocation ETF,23.63,0.0503,0.213,,2020,,
DEH,D8 Holdings Corp. Class A Ordinary Shares,9.83,-0.09,-0.907,Hong Kong,2020,Finance,Business Services
DEI,Douglas Emmett Inc. Common Stock,32.58,0.91,2.873,United States,2006,Consumer Services,Real Estate Investment Trusts
DELL,Dell Technologies Inc. Class C Common Stock ,87.32,1.57,1.831,,2018,Technology,Computer Manufacturing
DEN,Denbury Inc. Common Stock,43.33,2.07,5.017,,2020,Energy,Oil & Gas Production
DENN,Denny's Corporation Common Stock,18.1,0.14,0.78,United States,,Consumer Services,Restaurants
DEO,Diageo plc Common Stock,165.23,-0.43,-0.26,United Kingdom,,Consumer Non-Durables,Beverages (Production/Distribution)
DESP,Despegar.com Corp. Ordinary Shares,14.185,-0.125,-0.874,,2017,Consumer Services,Transportation Services
DEX,Delaware Enhanced Global Dividend Common Shares of Beneficial Interest,9.7302,0.0602,0.623,United States,2007,,
DFEB,FT Cboe Vest U.S. Equity Deep Buffer ETF - February,33,0.12,0.365,United States,2020,,
DFFN,Diffusion Pharmaceuticals Inc. Common Stock,0.9565,-0.0935,-8.905,United States,,Health Care,Major Pharmaceuticals
DFH,Dream Finders Homes Inc. Class A Common Stock,22,-0.16,-0.722,United States,2021,Capital Goods,Homebuilding
DFHT,Deerfield Healthcare Technology Acquisitions Corp. Class A Common Stock,13.45,-0.58,-4.134,United States,2020,Health Care,Hospital/Nursing Management
DFHTU,Deerfield Healthcare Technology Acquisitions Corp. Unit,14.5,-0.25,-1.695,United States,2020,Health Care,Hospital/Nursing Management
DFHTW,Deerfield Healthcare Technology Acquisitions Corp. Warrant,3.1,-0.4,-11.429,United States,2020,Health Care,Hospital/Nursing Management
DFHY,TrimTabs Donoghue Forlines Tactical High Yield ETF,24.89,-0.015,-0.06,,2020,,
DFIN,Donnelley Financial Solutions Inc. Common Stock ,26.69,0.25,0.946,,2016,Consumer Services,Other Consumer Services
DFNS,LGL Systems Acquisition Corp. Common Stock,10,0,0,United States,2020,Finance,Business Services
DFNV,TrimTabs Donoghue Forlines Risk Managed Innovation ETF,26.01,-0.1591,-0.608,,2020,,
DFP,Flaherty & Crumrine Dynamic Preferred and Income Fund Inc. Common Stock,30.07,0.08,0.267,,2013,,
DFPH,DFP Healthcare Acquisitions Corp. Class A Common Stock,10.025,-0.075,-0.743,United States,2020,Finance,Business Services
DFPHU,DFP Healthcare Acquisitions Corp. Unit,10.41,-0.51,-4.67,United States,2020,Finance,Business Services
DFPHW,DFP Healthcare Acquisitions Corp. Warrant,1.33,-0.07,-5,United States,2020,Finance,Business Services
DFS,Discover Financial Services Common Stock,94,2.02,2.196,United States,,Finance,Finance: Consumer Services
DG,Dollar General Corporation Common Stock,198.4852,1.3952,0.708,United States,2009,Consumer Services,Department/Specialty Retail Stores
DGICA,Donegal Group Inc. Class A Common Stock,14.645,0.305,2.127,United States,,Finance,Property-Casualty Insurers
DGICB,Donegal Group Inc. Class B Common Stock,13.46,-0.58,-4.131,United States,1986,Finance,Property-Casualty Insurers
DGII,Digi International Inc. Common Stock,18.975,-0.125,-0.654,United States,1989,Technology,Computer Communications Equipment
DGLY,Digital Ally Inc. Common Stock,1.79,-0.02,-1.105,United States,,Technology,Radio And Television Broadcasting And Communications Equipment
DGNR,Dragoneer Growth Opportunities Corp. Class A Ordinary Shares,10.1599,-0.3601,-3.423,United States,2020,Technology,Computer Software: Prepackaged Software
DGNS,Dragoneer Growth Opportunities Corp. II Class A Ordinary Shares,10.18,-0.19,-1.832,United States,2020,Finance,Business Services
DGNU,Dragoneer Growth Opportunities Corp. III Class A Ordinary Shares,10.005,0.005,0.05,United States,2021,Finance,Business Services
DGX,Quest Diagnostics Incorporated Common Stock,127.281,2.071,1.654,United States,,Health Care,Medical Specialities
DHBCU,DHB Capital Corp. Unit,9.87,-0.01,-0.101,United States,2021,Finance,Business Services
DHC,Diversified Healthcare Trust Common Shares of Beneficial Interest,4.88,0.06,1.245,United States,,Consumer Services,Real Estate Investment Trusts
DHCAU,DHC Acquisition Corp. Unit,9.81,-0.042,-0.426,United States,2021,Finance,Business Services
DHCNI,Diversified Healthcare Trust 5.625 Senior Notes due 2042,23.02,0.02,0.087,United States,,Consumer Services,Real Estate Investment Trusts
DHCNL,Diversified Healthcare Trust 6.25 Senior Notes Due 2046,23.7,-0.09,-0.378,United States,,Consumer Services,Real Estate Investment Trusts
DHF,BNY Mellon High Yield Strategies Fund Common Stock,3.0699,-0.0201,-0.65,United States,1998,,
DHHCU,DiamondHead Holdings Corp. Unit,9.85,-0.01,-0.101,United States,2021,Finance,Business Services
DHHCW,DiamondHead Holdings Corp. Warrant,0.75,0.75,,United States,2021,Finance,Business Services
DHI,D.R. Horton Inc. Common Stock,84.38,0.94,1.127,United States,,Capital Goods,Homebuilding
DHIL,Diamond Hill Investment Group Inc. Class A Common Stock,162.41,2.27,1.418,United States,,Finance,Investment Managers
DHR,Danaher Corporation Common Stock,219.4718,-0.8482,-0.385,United States,,Capital Goods,Industrial Machinery/Components
DHR^A,Danaher Corporation 4.75 Mandatory Convertible Preferred Stock Series A,1533,0,0,United States,,,
DHR^B,Danaher Corporation 5.00 Mandatory Convertible Preferred Stock Series B,1288.76,-4.43,-0.343,United States,,,
DHT,DHT Holdings Inc.,6.25,0.22,3.648,Jersey,2005,Transportation,Marine Transportation
DHX,DHI Group Inc. Common Stock,3,0.01,0.334,United States,2007,Miscellaneous,Business Services
DHY,Credit Suisse High Yield Bond Fund Common Stock,2.4,-0.01,-0.415,United States,1998,,
DIAX,Nuveen Dow 30SM Dynamic Overwrite Fund Common Shares of Beneficial Interest,16.02,0.07,0.439,,2014,,
DIN,Dine Brands Global Inc. Common Stock,86.18,1.8,2.133,United States,,Consumer Services,Restaurants
DIOD,Diodes Incorporated Common Stock,78.21,-4.26,-5.166,United States,,Technology,Semiconductors
DIS,Walt Disney Company (The) Common Stock,186.79,-1.94,-1.028,United States,,Consumer Services,Services-Misc. Amusement & Recreation
DISAU,Disruptive Acquisition Corporation I Unit,9.86,-0.14,-1.4,United States,,,
DISCA,Discovery Inc. Series A Common Stock,64.6,-7.08,-9.877,United States,,Consumer Services,Television Services
DISCB,Discovery Inc. Series B Common Stock,79.55,-2.92,-3.541,United States,,Consumer Services,Television Services
DISCK,Discovery Inc. Series C Common Stock,56.46,-6.53,-10.367,United States,,Consumer Services,Television Services
DISH,DISH Network Corporation Class A Common Stock,36.25,0.31,0.863,United States,1995,Consumer Services,Television Services
DIT,AMCON Distributing Company Common Stock,111,-0.5,-0.448,United States,,Consumer Non-Durables,Food Distributors
DJAN,FT Cboe Vest U.S. Equity Deep Buffer ETF - January,30.5768,0.0668,0.219,United States,2021,,
DJCO,Daily Journal Corp. (S.C.) Common Stock,320.08,3.08,0.972,United States,,Consumer Services,Newspapers/Magazines
DJUL,FT Cboe Vest U.S. Equity Deep Buffer ETF - July,32.1302,0,0,United States,2020,,
DJUN,FT Cboe Vest U.S. Equity Deep Buffer ETF - June,32.8707,-0.0324,-0.098,United States,2020,,
DK,Delek US Holdings Inc. Common Stock,23.18,1.64,7.614,United States,2017,Energy,Integrated oil Companies
DKL,Delek Logistics Partners L.P. Common Units representing Limited Partner Interests,35.75,0.45,1.275,United States,2012,Energy,Natural Gas Distribution
DKNG,DraftKings Inc. Class A Common Stock,68.49,-1.26,-1.806,United States,2019,Consumer Services,Services-Misc. Amusement & Recreation
DKS,Dick's Sporting Goods Inc Common Stock,74.54,-0.78,-1.036,United States,2002,Consumer Services,Other Specialty Stores
DLA,Delta Apparel Inc. Common Stock,25.51,-0.18,-0.701,United States,,Consumer Non-Durables,Apparel
DLB,Dolby Laboratories Common Stock,97.13,-0.42,-0.431,United States,2005,Miscellaneous,Multi-Sector Companies
DLCA,Deep Lake Capital Acquisition Corp. Class A Ordinary Shares,9.76,-0.005,-0.051,United States,2021,Finance,Business Services
DLCAU,Deep Lake Capital Acquisition Corp. Unit,10.06,-0.08,-0.789,United States,2021,Finance,Business Services
DLCAW,Deep Lake Capital Acquisition Corp. Warrant,0.67,-0.1099,-14.092,United States,2021,Finance,Business Services
DLHC,DLH Holdings Corp.,10.05,-0.1,-0.985,United States,,Technology,Professional Services
DLNG,Dynagas LNG Partners LP Common Units,2.86,-0.07,-2.389,Greece,,Consumer Services,Marine Transportation
DLNG^A,Dynagas LNG Partners LP 9.00 Series A Cumulative Redeemable Preferred Units,25.27,0.1089,0.433,Greece,,,
DLNG^B,Dynagas LNG Partners LP 8.75 Series B Fixed to Floating Rate Cumulative Redeemable Perpetual Preferred Units liquidation preference 25.00 per Uni,21.98,0.2542,1.17,Greece,,,
DLPN,Dolphin Entertainment Inc. Common Stock,22.5,4.17,22.75,United States,,Consumer Services,Other Consumer Services
DLR,Digital Realty Trust Inc. Common Stock,140.41,0.41,0.293,United States,2004,Consumer Services,Real Estate Investment Trusts
DLR^C,Digital Realty Trust Inc. 6.625 Series C Cumulative Redeemable Perpetual Preferred Stock,25.3681,-0.0921,-0.362,United States,,,
DLR^J,Digital Realty Trust Inc. 5.250 Series J Cumulative Redeemable Preferred Stock,26.588,0.148,0.56,United States,,,
DLR^K,Digital Realty Trust Inc. 5.850 Series K Cumulative Redeemable Preferred Stock par value 0.01 per share,27.73,0.15,0.544,United States,,,
DLR^L,Digital Realty Trust Inc. 5.200 Series L Cumulative Redeemable Preferred Stock,26.61,0.2,0.757,United States,,,
DLTH,Duluth Holdings Inc. Class B Common Stock,15.055,0.005,0.033,United States,2015,Consumer Services,Clothing/Shoe/Accessory Stores
DLTR,Dollar Tree Inc. Common Stock,111,1.14,1.038,United States,1995,Consumer Services,Department/Specialty Retail Stores
DLX,Deluxe Corporation Common Stock,39.33,0.21,0.537,United States,,Consumer Durables,Publishing
DLY,DoubleLine Yield Opportunities Fund Common Shares of Beneficial Interest,18.91,0.04,0.212,,2020,,
DM,Desktop Metal Inc. Class A Common Stock,17.27,-0.66,-3.681,,2019,Technology,Industrial Machinery/Components
DMAC,DiaMedica Therapeutics Inc. Common Stock,9.97,-0.28,-2.732,United States,2018,Health Care,Major Pharmaceuticals
DMAR,FT Cboe Vest U.S. Equity Deep Buffer ETF - March,29.8,0.0676,0.227,United States,2021,,
DMAY,FT Cboe Vest U.S. Equity Deep Buffer ETF - May,33.15,0.0602,0.182,United States,2020,,
DMB,BNY Mellon Municipal Bond Infrastructure Fund Inc. Common Stock,14.03,0.01,0.071,,2013,,
DMF,BNY Mellon Municipal Income Inc. Common Stock,8.6,0.02,0.233,United States,1988,,
DMLP,Dorchester Minerals L.P. Common Units Representing Limited Partnership Interests,14,0.21,1.523,United States,,Energy,Oil & Gas Production
DMO,Western Asset Mortgage Opportunity Fund Inc. Common Stock,14.565,-0.055,-0.376,United States,2010,,
DMRC,Digimarc Corporation Common Stock,35.54,-0.3,-0.837,United States,,Technology,EDP Services
DMS,Digital Media Solutions Inc. Class A Ordinary Shares,13.8,0.25,1.845,United States,2018,Miscellaneous,Business Services
DMTK,DermTech Inc. Common Stock,54.71,-5.18,-8.649,United States,2017,Health Care,Medical Specialities
DMYD,dMY Technology Group Inc. II Class A Common Stock,16.09,-0.01,-0.062,United States,2020,Finance,Business Services
DMYI,dMY Technology Group Inc. III Class A Common Stock,10.515,-0.115,-1.082,United States,2021,Finance,Business Services
DNB,Dun & Bradstreet Holdings Inc. Common Stock,24.085,0.095,0.396,United States,2020,Finance,Finance: Consumer Services
DNLI,Denali Therapeutics Inc. Common Stock,56.32,-1.88,-3.23,United States,2017,Health Care,Biotechnology: Biological Products (No Diagnostic Substances)
DNMR,Danimer Scientific Inc. Common Stock,42.68,-1.58,-3.57,,2020,Basic Industries,Major Chemicals
DNN,Denison Mines Corp Ordinary Shares (Canada),1.08,-0.01,-0.917,Canada,,Basic Industries,Precious Metals
DNOV,FT Cboe Vest U.S. Equity Deep Buffer ETF - November,33.92,0.0872,0.258,United States,2019,,
DNOW,NOW Inc. Common Stock,10.195,0.215,2.154,,2014,Energy,Metal Fabrications
DNP,DNP Select Income Fund Inc. Common Stock,9.84,0.04,0.408,United States,1987,,
DNZ,D and Z Media Acquisition Corp. Class A Common Stock,9.79,0,0,,2021,Finance,Business Services
DOC,Physicians Realty Trust Common Shares of Beneficial Interest,18.155,0.125,0.693,United States,2013,Consumer Services,Real Estate Investment Trusts
DOCN,DigitalOcean Holdings Inc.,43.8378,43.8378,,,,,
DOCT,FT Cboe Vest U.S. Equity Deep Buffer ETF - October,31.3641,0,0,United States,2020,,
DOCU,DocuSign Inc. Common Stock,199.86,-8.1,-3.895,United States,2018,Technology,Computer Software: Prepackaged Software
DOGZ,Dogness (International) Corporation Class A Common Stock,1.7897,-0.1403,-7.269,China,2017,Consumer Durables,Miscellaneous manufacturing industries
DOMO,Domo Inc. Class B Common Stock,59.24,-2.53,-4.096,United States,2018,Technology,Computer Software: Prepackaged Software
